{
  "manifest_version": "1.0",
  "manifest_id": "sale-historical-hanamdc23-v1",
  "status": "APPROVED",
  "review": {
    "reviewed_by": "hermes-agent-source-review",
    "reviewed_at": "2026-08-16T00:00:00Z",
    "approved_by": "hermes-agent-evidence-gate",
    "approved_at": "2026-08-16T00:00:00Z",
    "notes": "BODY_READ 또는 공개 본문 범위에서 경쟁절차와 terminal을 함께 확인한 normalized facts만 승인. 검색 title/snippet만의 claim은 제외하고 날짜·금액·순위를 추정하지 않음."
  },
  "sources": [
    {
      "id": "src_hanamdc23_s18",
      "url": "https://dealsite.co.kr/articles/113898",
      "publisher": "딜사이트",
      "document_type": "ARTICLE",
      "published_at": "2023-12-01",
      "accessed_at": "2026-08-16T00:00:00Z",
      "title": "하남 카카오 데이터센터 매각 셰어딜",
      "rights_status": "METADATA_ONLY",
      "access_status_reviewed": "BODY_READ_PARTIAL_PAYWALL_NOTICE",
      "metadata": {
        "chronology_source_id": "S18"
      }
    },
    {
      "id": "src_hanamdc23_s19",
      "url": "https://www.sedaily.com/NewsView/2DAIYDBGL1",
      "publisher": "서울경제",
      "document_type": "ARTICLE",
      "published_at": "2024-06-20",
      "accessed_at": "2026-08-16T00:00:00Z",
      "title": "맥쿼리, 하남 데이터센터 1조에 산다",
      "rights_status": "METADATA_ONLY",
      "access_status_reviewed": "BODY_READ",
      "metadata": {
        "chronology_source_id": "S19"
      }
    },
    {
      "id": "src_hanamdc23_s36",
      "url": "https://dealsite.co.kr/articles/134198",
      "publisher": "딜사이트",
      "document_type": "ARTICLE",
      "published_at": "2025-01-03",
      "accessed_at": "2026-08-16T00:00:00Z",
      "title": "2024 부동산 리그테이블",
      "rights_status": "METADATA_ONLY",
      "access_status_reviewed": "BODY_READ_PARTIAL_PAYWALL_NOTICE",
      "metadata": {
        "chronology_source_id": "S36"
      }
    }
  ],
  "asset": {
    "id": "asset_hanam_kakao_data_center",
    "canonical_name": "하남 데이터센터(카카오 임차)",
    "asset_class_id": "ac_dc",
    "jibun_address": "경기 하남시 풍산동",
    "status_code": "ACTIVE",
    "evidence": {
      "source_ids": [
        "src_hanamdc23_s18"
      ]
    }
  },
  "organizations": [
    {
      "id": "org_igis_am",
      "canonical_name": "이지스자산운용",
      "organization_type": "COMPANY",
      "evidence": {
        "source_ids": [
          "src_hanamdc23_s18",
          "src_hanamdc23_s19"
        ]
      }
    },
    {
      "id": "org_macquarie_korea_infrastructure_fund",
      "canonical_name": "맥쿼리한국인프라투융자회사",
      "organization_type": "FUND",
      "evidence": {
        "source_ids": [
          "src_hanamdc23_s19",
          "src_hanamdc23_s36"
        ]
      }
    },
    {
      "id": "org_jll_korea",
      "canonical_name": "JLL코리아",
      "organization_type": "COMPANY",
      "evidence": {
        "source_ids": [
          "src_hanamdc23_s19"
        ]
      }
    }
  ],
  "event": {
    "id": "event_sale_hanamdc23",
    "canonical_title": "하남 데이터센터(카카오 임차) 매각",
    "current_stage_code": "CLOSED",
    "date_precision": "YEAR",
    "lifecycle_status": "COMPLETED",
    "verification_level": "V2",
    "overall_confidence": 0.9,
    "evidence": {
      "source_ids": [
        "src_hanamdc23_s18",
        "src_hanamdc23_s19",
        "src_hanamdc23_s36"
      ]
    }
  },
  "process": {
    "id": "sp_hanamdc23",
    "process_code": "KR-SALE-DC-2023-HANAM-A",
    "sale_method": "SHARE_SALE",
    "process_status": "CLOSED",
    "currency_code": "KRW",
    "evidence": {
      "source_ids": [
        "src_hanamdc23_s18",
        "src_hanamdc23_s19",
        "src_hanamdc23_s36"
      ]
    },
    "metadata": {
      "source_process_id": "DC-2023-HANAM-A"
    }
  },
  "roles": [
    {
      "id": "role_hanamdc23_seller",
      "organization_id": "org_igis_am",
      "role_code": "SELLER",
      "evidence": {
        "source_ids": [
          "src_hanamdc23_s18",
          "src_hanamdc23_s19"
        ]
      }
    },
    {
      "id": "role_hanamdc23_advisor",
      "organization_id": "org_jll_korea",
      "role_code": "SELL_SIDE_ADVISOR",
      "evidence": {
        "source_ids": [
          "src_hanamdc23_s19"
        ]
      }
    }
  ],
  "rounds": [
    {
      "id": "round_hanamdc23_competitive",
      "round_no": 1,
      "round_code": "COMPETITIVE_202406",
      "round_type": "FINAL",
      "round_status": "COMPLETED",
      "announced_at": "2024-06-19",
      "evidence": {
        "source_ids": [
          "src_hanamdc23_s19"
        ]
      }
    }
  ],
  "participations": [
    {
      "id": "part_hanamdc23_macquarie",
      "round_id": "round_hanamdc23_competitive",
      "bidder_organization_id": "org_macquarie_korea_infrastructure_fund",
      "participation_status": "PREFERRED",
      "status_as_of": "2024-06-19",
      "confidence": 0.95,
      "evidence": {
        "source_ids": [
          "src_hanamdc23_s19"
        ]
      }
    }
  ],
  "participation_members": [],
  "submissions": [
    {
      "id": "submission_hanamdc23_macquarie",
      "claim_id": "claim_hanamdc23_macquarie_price",
      "participation_id": "part_hanamdc23_macquarie",
      "amount": null,
      "evidence": {
        "source_ids": [
          "src_hanamdc23_s19",
          "src_hanamdc23_s36"
        ]
      },
      "metadata": {
        "announced_acquisition_amount": {
          "kind": "EXACT",
          "decimal": "734000000000",
          "currency": "KRW",
          "basis": "ANNOUNCED_ACQUISITION_PRICE"
        }
      }
    }
  ],
  "funding": [],
  "decisions": [
    {
      "id": "decision_hanamdc23_macquarie_preferred",
      "round_id": "round_hanamdc23_competitive",
      "participation_id": "part_hanamdc23_macquarie",
      "decision_type": "PREFERRED",
      "decision_date": "2024-06-19",
      "decision_status": "VERIFIED",
      "confidence": 0.95,
      "evidence": {
        "source_ids": [
          "src_hanamdc23_s19"
        ]
      }
    }
  ],
  "milestones": [
    {
      "id": "milestone_hanamdc23_closed",
      "milestone_code": "CLOSED",
      "milestone_status": "CONFIRMED",
      "source_note": "2024년 완료 거래로 연말 리그테이블에 반영; 정확한 수익증권 이전일 미공개",
      "confidence": 0.85,
      "evidence": {
        "source_ids": [
          "src_hanamdc23_s36"
        ]
      },
      "metadata": {
        "date_precision": "YEAR",
        "period": "2024",
        "final_amount": {
          "kind": "EXACT",
          "decimal": "734000000000",
          "currency": "KRW",
          "basis": "ANNOUNCED_ACQUISITION_PRICE"
        }
      }
    }
  ]
}
